Sheet: Sheet1
A1: 1 | B1: 2 | C1: of:= [.A1] + [.B1] -> 3
A2: 3 | B2: 4 | C2: of:= [.A2] + [.B2] -> 7
A3: 5 | B3: 8 | C3: of:= [.A3] + [.B3] -> 13
A4: 7 | B4: 3 | C4: of:= [.A4] + [.B4] -> 10
A5: 9 | B5: 5 | C5: of:= [.A5] + [.B5] -> 14
A6: 11 | B6: 9 | C6: of:= [.A6] + [.B6] -> 20
A7: 13 | B7: 4 | C7: of:= [.A7] + [.B7] -> 17
A8: 15 | B8: 6 | C8: of:= [.A8] + [.B8] -> 21
A9: 17 | B9: 10 | C9: of:= [.A9] + [.B9] -> 27
A10: 19 | B10: 5 | C10: of:= [.A10] + [.B10] -> 24
A11: 21 | B11: 7 | C11: of:= [.A11] + [.B11] -> 28
A12: 23 | B12: 11 | C12: of:= [.A12] + [.B12] -> 34
A13: 25 | B13: 6 | C13: of:= [.A13] + [.B13] -> 31
A14: 27 | B14: 8 | C14: of:= [.A14] + [.B14] -> 35
A15: 29 | B15: 12 | C15: of:= [.A15] + [.B15] -> 41
A16: 31 | B16: 7 | C16: of:= [.A16] + [.B16] -> 38
A17: 33 | B17: 9 | C17: of:= [.A17] + [.B17] -> 42
A18: 35 | B18: 13 | C18: of:= [.A18] + [.B18] -> 48
A19: 37 | B19: 8 | C19: of:= [.A19] + [.B19] -> 45
A20: 39 | B20: 10 | C20: of:= [.A20] + [.B20] -> 49
A21: 41 | B21: 14 | C21: of:= [.A21] + [.B21] -> 55
A22: 43 | B22: 9 | C22: of:= [.A22] + [.B22] -> 52
A23: 45 | B23: 11 | C23: of:= [.A23] + [.B23] -> 56
A24: 47 | B24: 15 | C24: of:= [.A24] + [.B24] -> 62